{
  "schema": "knowledge-hub.paper.parsed-artifact-evidence-chunk-runtime-adapter-live-smoke.v1",
  "status": "ready",
  "generatedAt": "2026-05-28T19:20:26Z",
  "decision": "parsed_artifact_evidence_chunk_runtime_adapter_live_smoke_ready",
  "nextRecommendedTranche": "parsed_artifact_evidence_chunk_real_answer_quality_smoke",
  "smoke": {
    "query": "What section or paragraph evidence is available for these resolved papers?",
    "sourceType": "paper",
    "papersDirRef": "papers_dir",
    "resolvedPaperIds": [
      "1207.0580",
      "1301.3781"
    ],
    "queryPlanOptInKey": "parsed_artifact_evidence_chunk_adapter",
    "queryPlanOptInValue": "runtime_v1",
    "runtimeBoundary": "knowledge_hub.ai.evidence_assembly.EvidenceAssemblyService.assemble",
    "llmGenerationRows": 0,
    "suppliedSmokeAnswerOnly": true
  },
  "adapterDiagnostics": {
    "enabled": true,
    "status": "applied",
    "resolvedPaperIds": [
      "1207.0580",
      "1301.3781"
    ],
    "candidateRowsConsidered": 8,
    "rowsAdded": 4,
    "blockedRows": 0,
    "skippedReason": "",
    "maxRowsPerResolvedPaper": 2,
    "maxRowsTotal": 4,
    "fallbackToAllPapersAllowed": false,
    "selectedCandidateRecordIds": [
      "parsed-artifact-evidence-chunk-candidate:1207.0580:paragraph:cedd251525d1e551",
      "parsed-artifact-evidence-chunk-candidate:1207.0580:paragraph:fa5b9bc54ceb0f03",
      "parsed-artifact-evidence-chunk-candidate:1301.3781:paragraph:266306157ad5395f",
      "parsed-artifact-evidence-chunk-candidate:1301.3781:section:b6b0e5463a6bf99d"
    ],
    "blockedReasons": {}
  },
  "contract": {
    "evidencePacketAnswerable": true,
    "evidencePacketCoverageStatus": "complete",
    "answerContractAbstain": false,
    "answerContractCoverageStatus": "partial",
    "answerContractCitationRows": 4
  },
  "counts": {
    "resolvedPaperRows": 2,
    "adapterCandidateRowsConsidered": 8,
    "adapterRowsAdded": 4,
    "adapterBlockedRows": 0,
    "selectedEvidenceCount": 4,
    "citationCount": 4,
    "evidencePacketContractSpanRows": 4,
    "answerContractCitationRows": 4,
    "strictProvenanceSpanRows": 4,
    "answerableRows": 1,
    "answerContractAbstainRows": 0,
    "candidateStoreWriteRows": 0,
    "sourceSpanCreatedRows": 0,
    "strictEvidenceRows": 0,
    "parserExecutionRows": 0,
    "databaseMutationRows": 0,
    "indexMutationRows": 0,
    "reindexOrReembedRows": 0,
    "canonicalParsedArtifactWriteRows": 0,
    "vaultScanRows": 0,
    "externalDownloadRows": 0,
    "privatePathLeakRows": 0,
    "schemaViolationCount": 0
  },
  "gate": {
    "readyForRealAnswerQualitySmoke": true,
    "runtimeAdapterApplied": true,
    "strictProvenanceSpansReady": true,
    "answerContractHasCitations": true,
    "schemaViolations": []
  },
  "rows": [
    {
      "spanRef": "span:1",
      "citationLabel": "S1",
      "sourceId": "1207.0580",
      "sourceType": "paper",
      "sourceRef": "papers_dir/parsed/1207.0580/document.md",
      "sourceContentHash": "sha256:6eae057a9faf4f671c3101e0745ed704460c6d3dec77243dfd3a9f2d2ab68970",
      "contentHash": "sha256:0e5c43373f21a5d41f6dd42644438b983174c1b07423f5b45c464fdbf42b7d5c",
      "spanLocator": "chars:24-1424",
      "charStart": 24,
      "charEnd": 1424,
      "evidenceKind": "parsed_artifact_evidence_chunk",
      "candidateRecordId": "parsed-artifact-evidence-chunk-candidate:1207.0580:paragraph:cedd251525d1e551",
      "candidateStoreRef": "papers_dir/structured_evidence_candidates/evidence_chunk/1207.0580.jsonl",
      "artifactType": "paragraph",
      "excerptIncludedInReport": false
    },
    {
      "spanRef": "span:2",
      "citationLabel": "S2",
      "sourceId": "1207.0580",
      "sourceType": "paper",
      "sourceRef": "papers_dir/parsed/1207.0580/document.md",
      "sourceContentHash": "sha256:6eae057a9faf4f671c3101e0745ed704460c6d3dec77243dfd3a9f2d2ab68970",
      "contentHash": "sha256:f257c3ecfbf54be4d58b1c954bc455ae2d797a68bc2e6330a1718544b5959ed1",
      "spanLocator": "chars:5394-6794",
      "charStart": 5394,
      "charEnd": 6794,
      "evidenceKind": "parsed_artifact_evidence_chunk",
      "candidateRecordId": "parsed-artifact-evidence-chunk-candidate:1207.0580:paragraph:fa5b9bc54ceb0f03",
      "candidateStoreRef": "papers_dir/structured_evidence_candidates/evidence_chunk/1207.0580.jsonl",
      "artifactType": "paragraph",
      "excerptIncludedInReport": false
    },
    {
      "spanRef": "span:3",
      "citationLabel": "S3",
      "sourceId": "1301.3781",
      "sourceType": "paper",
      "sourceRef": "papers_dir/parsed/1301.3781/document.md",
      "sourceContentHash": "sha256:a44d7e22d2005752271c9cc1929c6462d4c8270916b063977992a883e3a54362",
      "contentHash": "sha256:1005c96e94dd7a4796fc24025ab24d95a28a229e22fc78f8881ada1fc743bca1",
      "spanLocator": "chars:24-1424",
      "charStart": 24,
      "charEnd": 1424,
      "evidenceKind": "parsed_artifact_evidence_chunk",
      "candidateRecordId": "parsed-artifact-evidence-chunk-candidate:1301.3781:paragraph:266306157ad5395f",
      "candidateStoreRef": "papers_dir/structured_evidence_candidates/evidence_chunk/1301.3781.jsonl",
      "artifactType": "paragraph",
      "excerptIncludedInReport": false
    },
    {
      "spanRef": "span:4",
      "citationLabel": "S4",
      "sourceId": "1301.3781",
      "sourceType": "paper",
      "sourceRef": "papers_dir/parsed/1301.3781/document.md",
      "sourceContentHash": "sha256:a44d7e22d2005752271c9cc1929c6462d4c8270916b063977992a883e3a54362",
      "contentHash": "sha256:c3b813991e5860d20fb8ea5bd46ef6a68988d895c43e88a79604f57b68cd7a6e",
      "spanLocator": "chars:992-1424",
      "charStart": 992,
      "charEnd": 1424,
      "evidenceKind": "parsed_artifact_evidence_chunk",
      "candidateRecordId": "parsed-artifact-evidence-chunk-candidate:1301.3781:section:b6b0e5463a6bf99d",
      "candidateStoreRef": "papers_dir/structured_evidence_candidates/evidence_chunk/1301.3781.jsonl",
      "artifactType": "section",
      "excerptIncludedInReport": false
    }
  ],
  "warnings": []
}
